{
  "$schema": "https://json-schema.org/draft/2020-12/schema",
  "$id": "https://github.com/zhanghao1903/macos-computer-use/blob/main/plugins/codex-engineering-lifecycle/schemas/release-result.schema.json",
  "title": "ReleaseResult",
  "type": "object",
  "additionalProperties": false,
  "required": ["schemaVersion", "workflowId", "featureId", "authorizationId", "mergeCommitSha", "version", "tag", "targets", "publishedAt"],
  "properties": {
    "schemaVersion": {"const": 1},
    "workflowId": {"type": "string", "format": "uuid"},
    "featureId": {"$ref": "#/$defs/featureId"},
    "authorizationId": {"$ref": "#/$defs/digest"},
    "mergeCommitSha": {"$ref": "#/$defs/sha"},
    "version": {"$ref": "#/$defs/semver"},
    "tag": {"type": "string", "minLength": 1, "maxLength": 200},
    "targets": {"type": "array", "minItems": 1, "maxItems": 20, "items": {"$ref": "#/$defs/targetResult"}},
    "publishedAt": {"$ref": "#/$defs/timestamp"},
    "proofDigest": {"$ref": "#/$defs/digest"}
  },
  "$defs": {
    "digest": {"type": "string", "pattern": "^[0-9a-f]{64}$"},
    "sha": {"type": "string", "pattern": "^[0-9a-f]{40}$"},
    "featureId": {"type": "string", "pattern": "^[a-z0-9](?:[a-z0-9-]{0,62}[a-z0-9])?-[0-9a-f]{12}$", "maxLength": 76},
    "timestamp": {"type": "string", "format": "date-time", "pattern": "^\\d{4}-\\d{2}-\\d{2}T\\d{2}:\\d{2}:\\d{2}Z$"},
    "semver": {"type": "string", "pattern": "^(0|[1-9][0-9]*)\\.(0|[1-9][0-9]*)\\.(0|[1-9][0-9]*)(?:-[0-9A-Za-z-]+(?:\\.[0-9A-Za-z-]+)*)?(?:\\+[0-9A-Za-z-]+(?:\\.[0-9A-Za-z-]+)*)?$", "maxLength": 100},
    "publishedArtifact": {
      "type": "object",
      "additionalProperties": false,
      "required": ["name", "sha256", "url"],
      "properties": {
        "name": {"type": "string", "pattern": "^[A-Za-z0-9][A-Za-z0-9._+-]{0,199}$"},
        "sha256": {"$ref": "#/$defs/digest"},
        "url": {"type": "string", "format": "uri", "pattern": "^https://"}
      }
    },
    "targetResult": {
      "oneOf": [
        {
          "type": "object",
          "additionalProperties": false,
          "required": ["targetId", "kind", "status", "error"],
          "properties": {
            "targetId": {"$ref": "#/$defs/digest"},
            "kind": {"enum": ["GITHUB_RELEASE", "PYPI"]},
            "status": {"const": "FAILED"},
            "error": {"type": "string", "minLength": 1, "maxLength": 300}
          }
        },
        {
          "type": "object",
          "additionalProperties": false,
          "required": ["targetId", "kind", "status", "artifacts", "publishedAt", "releaseUrl", "tagCommitSha"],
          "properties": {
            "targetId": {"$ref": "#/$defs/digest"},
            "kind": {"const": "GITHUB_RELEASE"},
            "status": {"const": "PUBLISHED"},
            "artifacts": {"type": "array", "minItems": 1, "maxItems": 100, "items": {"$ref": "#/$defs/publishedArtifact"}},
            "publishedAt": {"$ref": "#/$defs/timestamp"},
            "releaseUrl": {"type": "string", "format": "uri", "pattern": "^https://github\\.com/"},
            "tagCommitSha": {"$ref": "#/$defs/sha"}
          }
        },
        {
          "type": "object",
          "additionalProperties": false,
          "required": ["targetId", "kind", "status", "artifacts", "publishedAt", "projectUrl", "repository", "projectName", "version"],
          "properties": {
            "targetId": {"$ref": "#/$defs/digest"},
            "kind": {"const": "PYPI"},
            "status": {"const": "PUBLISHED"},
            "artifacts": {"type": "array", "minItems": 1, "maxItems": 100, "items": {"$ref": "#/$defs/publishedArtifact"}},
            "publishedAt": {"$ref": "#/$defs/timestamp"},
            "projectUrl": {"type": "string", "format": "uri", "pattern": "^https://"},
            "repository": {"enum": ["PYPI", "TEST_PYPI"]},
            "projectName": {"type": "string", "minLength": 1, "maxLength": 200},
            "version": {"$ref": "#/$defs/semver"}
          }
        }
      ]
    }
  }
}
